{
 "$schema": "https://phonology024.github.io/make-localllm-easier/catalog/v1/schema.json",
 "catalog_version": 1,
 "catalog_rev": "ae434cf45eaea48d",
 "license": "MIT",
 "source": "https://github.com/phonology024/make-localllm-easier",
 "scores_are": "0-100 from `localllm eval`, keyed language/suite (en/global, th/regional, ...): accuracy in percent, chrF++ for */translate and */summarize",
 "hardware": [
  {
   "id": "rx9070xt-windows-vulkan",
   "gpu": "AMD Radeon RX 9070 XT",
   "vram_gb": 15.9,
   "ram_gb": 32.0,
   "os": "Windows 11",
   "runtime": "llama.cpp",
   "backend": "vulkan"
  }
 ],
 "models": [
  {
   "id": "qwen3.8-27b-q3",
   "format": "gguf",
   "hf_repo": "unsloth/Qwen3.8-27B-GGUF",
   "file": "Qwen3.8-27B-UD-Q3_K_XL.gguf",
   "rev": "4ca720788d1e01f1bff70c033e0d0028fd02e502",
   "sha256": "8c2a45ff85e7674ca185ec8eb6cdeab0e617ed9d8018caed0b64380eb2a67a5e",
   "bits_per_weight": 3.8,
   "qat": false,
   "max_ctx": 262144,
   "moe": null,
   "memory": {
    "weights_gib": 12.2,
    "kv_kib_per_token_q8": 34.8,
    "fixed_cache_gib": 0.15,
    "checkpoint_gib": 0.15,
    "cpu_mapped_gib": 0.51
   },
   "vision": {
    "mmproj_file": "mmproj-F16.gguf",
    "mmproj_gib": 0.86,
    "mmproj_sha256": "cbb841a9ee0636b2ec172f5bb8df2ea8dfeb01e90fe7c6126581d662a0b4e43e"
   },
   "speed": [
    {
     "hardware": "rx9070xt-windows-vulkan",
     "llama_cpp": "b11476",
     "decode_tok_s": 50,
     "confidence": "measured",
     "mtp_draft_tokens": 2
    }
   ],
   "scores": {
    "ar/global": 70.8,
    "ar/regional": 71.2,
    "ar/translate": 59.0,
    "en/global": 81.5,
    "en/math": 94.4,
    "es/global": 80.2,
    "es/regional": 76.8,
    "hi/global": 69.0,
    "hi/regional": 74.3,
    "hi/translate": 58.1,
    "ja/global": 73.5,
    "ja/regional": 87.6,
    "ja/translate": 46.4,
    "th/math": 87.2,
    "th/regional": 67.1,
    "th/translate": 54.1,
    "zh/global": 76.2,
    "zh/math": 84.4,
    "zh/regional": 74.7,
    "zh/translate": 49.1
   },
   "note": "dense 27B; built-in MTP head drafts 2 tokens"
  },
  {
   "id": "gemma4-26b-a4b-qat",
   "format": "gguf",
   "hf_repo": "unsloth/gemma-4-26B-A4B-it-qat-GGUF",
   "file": "gemma-4-26B-A4B-it-qat-UD-Q4_K_XL.gguf",
   "rev": "7b92b5b28818151e8669af2e45e88d6086f490dd",
   "sha256": "a7c5bc715f5ff8e99a3e8901ce7d2b42b402c669bf24f7c5250747633d0f5891",
   "bits_per_weight": 4.2,
   "qat": true,
   "max_ctx": 262144,
   "moe": {
    "layers": 30,
    "expert_gib_per_layer": 0.4
   },
   "memory": {
    "weights_gib": 13.3,
    "kv_kib_per_token_q8": 10.9,
    "fixed_cache_gib": 0.11,
    "checkpoint_gib": 0.11,
    "cpu_mapped_gib": null
   },
   "vision": {
    "mmproj_file": "mmproj-F16.gguf",
    "mmproj_gib": 1.11,
    "mmproj_sha256": "d00f211a7d4f7fb19bd9b75d8e9342eccffb5920b08fd9562167560fdfcc5dd1"
   },
   "speed": [
    {
     "hardware": "rx9070xt-windows-vulkan",
     "llama_cpp": "b11476",
     "decode_tok_s": 90,
     "confidence": "measured",
     "mtp_draft_tokens": 0,
     "moe_offload": [
      {
       "layers_in_ram": 8,
       "decode_tok_s": 45
      },
      {
       "layers_in_ram": 13,
       "decode_tok_s": 36
      },
      {
       "layers_in_ram": 18,
       "decode_tok_s": 31
      }
     ]
    }
   ],
   "scores": {
    "ar/global": 71.5,
    "ar/regional": 73.6,
    "ar/translate": 61.9,
    "en/global": 82.2,
    "en/math": 96.8,
    "es/global": 74.5,
    "es/regional": 75.2,
    "hi/global": 69.5,
    "hi/regional": 71.0,
    "hi/translate": 62.8,
    "ja/global": 74.5,
    "ja/regional": 81.9,
    "ja/translate": 48.0,
    "th/math": 89.6,
    "th/regional": 65.7,
    "th/translate": 55.6,
    "zh/global": 73.5,
    "zh/math": 88.8,
    "zh/regional": 66.5,
    "zh/translate": 47.7
   },
   "note": "MoE with ~4B active params: fastest"
  },
  {
   "id": "qwen3.8-27b-iq2",
   "format": "gguf",
   "hf_repo": "unsloth/Qwen3.8-27B-GGUF",
   "file": "Qwen3.8-27B-UD-IQ2_S.gguf",
   "rev": "4ca720788d1e01f1bff70c033e0d0028fd02e502",
   "sha256": "7897d2c5a5cee46aef50895141b2c8a0803c1185f3d03c4fda4cd137a7ad77fe",
   "bits_per_weight": 2.5,
   "qat": false,
   "max_ctx": 262144,
   "moe": null,
   "memory": {
    "weights_gib": 7.8,
    "kv_kib_per_token_q8": 34.8,
    "fixed_cache_gib": 0.15,
    "checkpoint_gib": 0.15,
    "cpu_mapped_gib": null
   },
   "vision": {
    "mmproj_file": "mmproj-F16.gguf",
    "mmproj_gib": 0.86,
    "mmproj_sha256": "cbb841a9ee0636b2ec172f5bb8df2ea8dfeb01e90fe7c6126581d662a0b4e43e"
   },
   "speed": [
    {
     "hardware": "rx9070xt-windows-vulkan",
     "llama_cpp": "b11476",
     "decode_tok_s": 40,
     "confidence": "measured",
     "mtp_draft_tokens": 0
    }
   ],
   "scores": {
    "ar/global": 60.8,
    "ar/regional": 57.2,
    "en/global": 74.2,
    "es/global": 70.8,
    "es/regional": 69.2,
    "hi/global": 56.2,
    "hi/regional": 55.5,
    "ja/global": 65.8,
    "ja/regional": 77.9,
    "th/regional": 54.2,
    "zh/global": 67.8,
    "zh/regional": 67.8
   },
   "note": "for 10-12 GB cards only: 2-bit costs 8-13 points, most in Hindi, Arabic, Thai"
  },
  {
   "id": "qwen3.5-9b-q4",
   "format": "gguf",
   "hf_repo": "unsloth/Qwen3.5-9B-GGUF",
   "file": "Qwen3.5-9B-UD-Q4_K_XL.gguf",
   "rev": "3885219b6810b007914f3a7950a8d1b469d598a5",
   "sha256": "6f5d30666c2d8ae16a306e616d95341dcf3cc46810df84d7e6f5a7d1e4c1b293",
   "bits_per_weight": 5.3,
   "qat": false,
   "max_ctx": 262144,
   "moe": null,
   "memory": {
    "weights_gib": 5.6,
    "kv_kib_per_token_q8": 17.0,
    "fixed_cache_gib": 0.1,
    "checkpoint_gib": 0.1,
    "cpu_mapped_gib": null
   },
   "vision": {
    "mmproj_file": "mmproj-F16.gguf",
    "mmproj_gib": 0.86,
    "mmproj_sha256": "f70dc3509053962b0d0d3ee8a7eacebf5d60aa560cad78254ae8698516ae029f"
   },
   "speed": [
    {
     "hardware": "rx9070xt-windows-vulkan",
     "llama_cpp": "b11476",
     "decode_tok_s": 42,
     "confidence": "measured",
     "mtp_draft_tokens": 0
    }
   ],
   "scores": {
    "ar/global": 65.8,
    "ar/regional": 66.4,
    "ar/translate": 57.5,
    "en/global": 80.5,
    "en/math": 93.6,
    "es/global": 76.0,
    "es/math": 90.0,
    "es/regional": 73.2,
    "es/translate": 56.5,
    "hi/global": 61.0,
    "hi/regional": 70.2,
    "hi/translate": 56.9,
    "ja/global": 68.0,
    "ja/math": 81.6,
    "ja/regional": 82.3,
    "ja/translate": 44.8,
    "th/math": 83.2,
    "th/regional": 61.1,
    "th/translate": 52.1,
    "zh/global": 74.5,
    "zh/math": 84.4,
    "zh/regional": 73.5,
    "zh/translate": 46.6
   },
   "note": "dense 9B (hybrid attention, like Qwen3.8): for 8-12 GB cards"
  },
  {
   "id": "gemma4-e4b-q4",
   "format": "gguf",
   "hf_repo": "unsloth/gemma-4-E4B-it-GGUF",
   "file": "gemma-4-E4B-it-UD-Q4_K_XL.gguf",
   "rev": "bfc15c382204943c3a8fff0c750b94ae2364d7a3",
   "sha256": "3cf61de12daa015ee0f7b68e7b7c541405bf220e1e942bad8b47cab827d7df80",
   "bits_per_weight": 5.5,
   "qat": false,
   "max_ctx": 131072,
   "moe": null,
   "memory": {
    "weights_gib": 4.8,
    "kv_kib_per_token_q8": 14.9,
    "fixed_cache_gib": 0.02,
    "checkpoint_gib": 0.02,
    "cpu_mapped_gib": 2.5
   },
   "vision": {
    "mmproj_file": "mmproj-F16.gguf",
    "mmproj_gib": 0.92,
    "mmproj_sha256": "ddf46c21d7078e95338cfc22306b19b276a29a5ad089023449dd54d4b6170a51"
   },
   "speed": [
    {
     "hardware": "rx9070xt-windows-vulkan",
     "llama_cpp": "b11476",
     "decode_tok_s": 105,
     "confidence": "measured",
     "mtp_draft_tokens": 0
    }
   ],
   "scores": {
    "ar/global": 62.5,
    "ar/regional": 66.0,
    "ar/translate": 60.8,
    "en/global": 71.5,
    "en/math": 92.4,
    "es/global": 66.2,
    "es/math": 88.8,
    "es/regional": 70.8,
    "es/translate": 55.6,
    "hi/global": 57.8,
    "hi/regional": 71.0,
    "hi/translate": 60.9,
    "ja/global": 60.8,
    "ja/math": 76.4,
    "ja/regional": 69.5,
    "ja/translate": 46.7,
    "th/math": 87.6,
    "th/regional": 52.9,
    "th/translate": 54.8,
    "zh/global": 63.5,
    "zh/math": 83.6,
    "zh/regional": 53.9,
    "zh/translate": 45.8
   },
   "note": "~4B effective; per-layer embeddings (~2.5 GB) stay in system RAM by design: for 6 GB cards"
  },
  {
   "id": "qwen3.5-4b-q4",
   "format": "gguf",
   "hf_repo": "unsloth/Qwen3.5-4B-GGUF",
   "file": "Qwen3.5-4B-UD-Q4_K_XL.gguf",
   "rev": "e87f176479d0855a907a41277aca2f8ee7a09523",
   "sha256": "b252c5610a42ca82d20fe2a12813e9d069eed89292907e26c783eeb0bc961bc7",
   "bits_per_weight": 5.8,
   "qat": false,
   "max_ctx": 262144,
   "moe": null,
   "memory": {
    "weights_gib": 2.7,
    "kv_kib_per_token_q8": 17.0,
    "fixed_cache_gib": 0.06,
    "checkpoint_gib": 0.06,
    "cpu_mapped_gib": null
   },
   "vision": {
    "mmproj_file": "mmproj-F16.gguf",
    "mmproj_gib": 0.63,
    "mmproj_sha256": "cd88edcf8d031894960bb0c9c5b9b7e1fea6ebee02b9f7ce925a00d12891f864"
   },
   "speed": [
    {
     "hardware": "rx9070xt-windows-vulkan",
     "llama_cpp": "b11476",
     "decode_tok_s": 78,
     "confidence": "measured",
     "mtp_draft_tokens": 0
    }
   ],
   "scores": {
    "ar/global": 63.0,
    "ar/regional": 61.6,
    "ar/translate": 55.4,
    "en/global": 75.5,
    "en/math": 91.6,
    "es/global": 70.5,
    "es/math": 88.8,
    "es/regional": 70.0,
    "es/translate": 55.1,
    "hi/global": 54.2,
    "hi/regional": 61.2,
    "hi/translate": 53.4,
    "ja/global": 65.5,
    "ja/math": 76.8,
    "ja/regional": 70.7,
    "ja/translate": 43.7,
    "th/math": 81.2,
    "th/regional": 51.2,
    "th/translate": 51.1,
    "zh/global": 69.0,
    "zh/math": 84.4,
    "zh/regional": 69.0,
    "zh/translate": 45.4
   },
   "note": "dense 4B: the first-run starter (chat in about a minute) and for 4-6 GB cards"
  }
 ]
}
